{
  "schema": "outcome.run-brief.v1",
  "brief_id": "urn:ixo:run-brief:bafyexamplebrief001",
  "workflow_id": "wf-clean-water-001",
  "created_at": "2026-03-02T09:00:00Z",
  "why": "Decide whether the Kitui borehole rehabilitation program can make a defensible public claim about reduced childhood waterborne disease, and at what strength.",
  "what": "Immediately: a validated causal model of the program's theory of change with its evidence mapped onto it. Finally: a validation report stating the attainable claim tier, and — if an authorized reviewer approves — an outcome certificate worded to exactly that tier.",
  "who": "You supply the theory of change and the evidence, and confirm the outcome wording. Specialist agents extract, model, and check. The Kitui County Outcomes Authority reviews and issues.",
  "where": "Accepted sources are listed below. Everything durable is written to runs/wf-clean-water-001/. External systems: the evaluations engine (claim submission and receipts) and the graph oracle (ExternalSource checks).",
  "run_kind": "issuance",
  "target_tier": 3,
  "outcome_focus": {
    "statement": "Reduced under-five waterborne disease incidence in the program catchment.",
    "provisional": false
  },
  "sources": [
    {
      "artifact_id": "src-toc-narrative",
      "label": "Safe Water for Kitui — program theory of change (narrative, 4pp)",
      "sha256": "3fa1c0d1b9e84f2a7c5b6d8e9f0a1b2c3d4e5f60718293a4b5c6d7e8f9a0b1c2"
    }
  ],
  "exclusions": [
    "Cost-effectiveness and value-for-money are out of scope: no financial data was supplied.",
    "Water points outside the registered Kitui catchment are excluded, including the three sites added after 2026-06-30.",
    "Adult diarrheal disease is out of scope; the claim is limited to under-fives."
  ]
}
